{
  "$schema": "../schema/app.schema.json",
  "schema_version": 1,
  "id": "com.getartcraft.GridCraft",
  "name": "GridCraft",
  "summary": "Spreadsheets and data analysis",
  "description": "GridCraft is an open-source, clean-room spreadsheet in pure Rust, in the style of Microsoft Excel.\n\nPart of the ArtCraft crafting apps.",
  "developer": "ArtCraft",
  "license": "MIT OR Apache-2.0",
  "homepage": "https://getartcraft.com/apps/gridcraft",
  "source_code": "https://github.com/storytold/gridcraft",
  "icon": "https://getartcraft.com/images/apps/gridcraft/icon.webp",
  "topics": [
    "office",
    "science"
  ],
  "tags": [
    "artcraft",
    "spreadsheet",
    "excel",
    "xlsx",
    "rust"
  ],
  "installers": [
    {
      "platform": "linux",
      "arch": [
        "x86_64"
      ],
      "kind": "download",
      "format": "appimage",
      "github": {
        "repo": "storytold/gridcraft",
        "asset": "^gridcraft-[0-9][0-9A-Za-z.+-]*-linux-x86_64\\.AppImage$"
      }
    },
    {
      "platform": "linux",
      "arch": [
        "aarch64"
      ],
      "kind": "download",
      "format": "appimage",
      "github": {
        "repo": "storytold/gridcraft",
        "asset": "^gridcraft-[0-9][0-9A-Za-z.+-]*-linux-aarch64\\.AppImage$"
      }
    },
    {
      "platform": "windows",
      "arch": [
        "x86_64"
      ],
      "kind": "download",
      "format": "archive",
      "github": {
        "repo": "storytold/gridcraft",
        "asset": "^gridcraft-[0-9][0-9A-Za-z.+-]*-windows-x64-portable\\.zip$"
      },
      "exec": "gridcraft.exe"
    },
    {
      "platform": "windows",
      "arch": [
        "aarch64"
      ],
      "kind": "download",
      "format": "archive",
      "github": {
        "repo": "storytold/gridcraft",
        "asset": "^gridcraft-[0-9][0-9A-Za-z.+-]*-windows-arm64-portable\\.zip$"
      },
      "exec": "gridcraft.exe"
    },
    {
      "platform": "windows",
      "arch": [
        "x86_64"
      ],
      "kind": "download",
      "format": "installer",
      "github": {
        "repo": "storytold/gridcraft",
        "asset": "^gridcraft-[0-9][0-9A-Za-z.+-]*-windows-x64\\.msi$"
      }
    },
    {
      "platform": "macos",
      "kind": "download",
      "format": "installer",
      "github": {
        "repo": "storytold/gridcraft",
        "asset": "^gridcraft-[0-9][0-9A-Za-z.+-]*-macos-universal\\.dmg$"
      }
    }
  ]
}
